Question,Question Type,Answer Option 1,Explanation 1,Answer Option 2,Explanation 2,Answer Option 3,Explanation 3,Answer Option 4,Explanation 4,Answer Option 5,Explanation 5,Answer Option 6,Explanation 6,Correct Answers,Overall Explanation,Domain
"A data platform team designs an AI-powered pipeline within Snowflake. The pipeline first uses AI_PARSE_DOCUMENT to extract information from sensitive PDF invoices stored in a stage. Next, it uses SNOWFLAKE.CORTEX.EMBED_TEXT_1024 on the extracted text to create embeddings, and finally, SNOWFLAKE.CORTEX.COMPLETE with mistral-large2 to summarize key invoice details. The account has CORTEX_ENABLED_CROSS_REGION set to ANY_REGION. At which point in this pipeline, if any, could customer document content, extracted text, or embeddings potentially leave Snowflake's governance boundary to a third-party LLM provider (assuming default Snowflake configurations for Cortex functions)?",multiple-choice,"During the AI_PARSE_DOCUMENT step, as it uses advanced LLMs which might be externally hosted for document processing.",,"During the CORTEX.COMPLETE function call using mistral-large2, since this model may be hosted externally and can involve data egress beyond Snowflake's internal boundary.",,"During the EMBED_TEXT_1024 step, especially with CORTEX_ENABLED_CROSS_REGION = ANY_REGION, since embeddings might be generated by an external service.",,"The CORTEX_MODELS_ALLOWLIST setting, if not properly configured, could cause egress during COMPLETE.",,Data for all these operations always remains within Snowflake's governance boundary.,,,,2,,
A data engineering team is building a Retrieval Augmented Generation (RAG) pipeline that heavily relies on SNOWFLAKE.CORTEX.EMBED_TEXT_768 to process millions of documents daily. They need to optimize for both cost and retrieval quality. Which of the following statements are true regarding the cost and performance of EMBED_TEXT_768 in Snowflake? (Select all that apply),multi-select,"The EMBED_TEXT_768 function is billed based on the number of 'output tokens' generated by the embedding model, as this represents the computational complexity of the vector.",,"To minimize costs for EMBED_TEXT_768 operations, it is recommended to execute queries using a smaller virtual warehouse (no larger than MEDIUM), as larger warehouses do not improve performance for these functions.",,"The snowflake-arctic-embed-m-v1.5 model, used by EMBED_TEXT_768, has a context window of 512 tokens, and texts exceeding this length are truncated before embedding.",,"For optimal retrieval quality in RAG scenarios, text should be split into chunks of no more than 512 tokens before being passed to EMBED_TEXT_768, even if the model supports a larger context window.",,"The EMBED_TEXT_768 function, regardless of the 768-dimension model used, has a fixed cost of 1.50 Credits per one million Tokens processed.",,,,"2,3,4,5",,
"A data engineering team is optimizing an AI-infused pipeline that processes millions of rows of customer interaction data in a LOG_DATA table using various Snowflake Cortex AI functions. They need to accurately estimate costs and ensure optimal performance. Which of the following statements regarding cost, performance, and operational considerations for these functions are true? (select all that apply)",multi-select,"When using AI_COMPLETE or COMPLETE for generating responses, both input and output tokens are billable. The total tokens processed increase proportionally if previous conversation history is passed to a stateful experience.",,"For functions like AI_CLASSIFY or AI_SENTIMENT, only input tokens are counted towards the billable total, as these functions do not generate new text but rather categorize or score existing text.",,"The AI_AGG function is not subject to context window limitations when aggregating text columns across multiple rows, allowing it to process large volumes of text without exceeding token limits.",,Executing queries that call Cortex AI functions such as AI_COMPLETE or AI_AGG in an X-LARGE or larger warehouse will significantly improve their processing speed and reduce overall latency.,,"For Cortex Analyst, credit usage is based on the number of messages processed, regardless of the number of tokens in each message, with billing occurring only for successful responses (HTTP 200).",,,,"1,2",,
"An operations manager is concerned about governance and monitoring of a newly deployed Cortex Analyst application, especially regarding cost tracking and multi-turn conversations. Which statement accurately describes a feature for monitoring or managing a Cortex Analyst application?",multiple-choice,"Credit consumption for Cortex Analyst is primarily based on the number of tokens processed by the underlying LLMs, with complex questions leading to higher token usage and increased costs.",,"Cortex Analyst's multi-turn conversation feature inherently caches previous responses to reduce inference latency, which can be cleared using a RESET_CONVERSATION command to optimize costs.",,"Administrators can query the SNOWFLAKE.CORTEX_ANALYST_REQUESTS function, specifying either 'SEMANTIC_MODEL' or 'SEMANTIC_VIEW' for the semantic model type, to review details such as user questions, generated SQL, and errors.",,Enabling Azure OpenAI models via the ENABLE_CORTEX_ANALYST_MODEL_AZURE_OPENAI parameter ensures that all customer data and prompts remain within Snowflake's governance boundary and respect RBAC policies for those models.,,"To provide a stateful conversational experience, the Cortex Analyst REST API automatically retains the full conversation history for a user, removing the need to explicitly pass it with each new prompt.",,,,3,,
A development team is preparing to deploy a new Retrieval-Augmented Generation (RAG) application written in Python. They intend to use Snowflake AI Observability with the TruLens SDK to capture detailed logs and traces for debugging and performance analysis. Which of the following configurations are essential prerequisites for enabling this logging capability effectively? (Select all that apply),multi-select,TRULENS_OTEL_TRACING environment variable,,Required TruLens packages,,Required roles (SNOWFLAKE_CORTEX_USER + AI_OBSERVABILITY_EVENTS_LOOKUP),,Must run exclusively in Snowflake Notebook,,CREATE EXTERNAL AGENT and CREATE TASK privileges,,,,"1,2,3",,
"A data engineering team is developing a Cortex Analyst semantic model in YAML for an e-commerce platform. They need to ensure high accuracy for common queries, improve literal matching for product names, and understand limitations for supported data types. Which of the following statements correctly describe aspects of semantic model configuration or capabilities for these requirements? (select three)",multi-select,"To improve literal matching for a product_name dimension, a Cortex Search Service can be integrated by specifying a cortex_search_service block within the dimension's definition",,The semantic model definition supports using VARIANT and OBJECT data types for dimension and fact columns,,Highly accurate SQL queries for specific natural language questions can be pre-defined and suggested to users by adding them to the verified_queries section,,"For dimensions with millions of unique values, such as customer_id, leveraging the sample_values field is recommended to guide literal search and avoid LLM context window limits",,"The semantic model's base_table parameter can directly point to a stage location, allowing YAML files on that stage to serve as the direct data source",,,,"1,2,3",,
"An ML engineer is developing a RAG application in Python and wants to use the TruLens SDK to trace the distinct phases of its execution, specifically the context retrieval and answer generation steps. They aim to clearly differentiate the tracing of the function responsible for retrieving context. Which code snippet correctly instruments the retrieve_context function for tracing with the appropriate span type for a retrieval operation?",multiple-choice,"from trulens_core import instrument, SpanAttributes; @instrument(span_type=SpanAttributes.SpanType.RETRIEVAL) def retrieve_context(self, query: str) -> list: # ... retrieval logic ... return self._retrieve(query)",,"from trulens_core import instrument; @instrument(span_type='RETRIEVAL') def retrieve_context(self, query: str) -> list: # ... retrieval logic ... return self._retrieve(query)",,"from trulens_core import instrument, SpanAttributes; @instrument(span_type=SpanAttributes.SpanType.GENERATION) def retrieve_context(self, query: str) -> list: # ... retrieval logic ... return self._retrieve(query)",,"from trulens_core import instrument; @instrument() def retrieve_context(self, query: str) -> list: # ... retrieval logic ... return self._retrieve(query)",,"from trulens_core import trace_function, SpanTypes; @trace_function(SpanTypes.RETRIEVAL) def retrieve_context(self, query: str) -> list: # ... retrieval logic ... return self._retrieve(query)",,,,1,,
"A data architect is evaluating the shift from managing Cortex Analyst semantic models as YAML files on internal stages to leveraging a native semantic view (currently in Public Preview). They want to understand the key differences and advantages or considerations of this new native approach. Which of the following statements accurately describe a key characteristic or implication of using native semantic views for Cortex Analyst, compared to YAML files stored in a stage? (select all that apply)",multi-select,"Native semantic views eliminate the need for an underlying base_table definition, as the view itself directly defines the logical structure and data source for Cortex Analyst queries.",,"When a semantic model is stored as a native semantic view, the CORTEX_ANALYST_REQUESTS function must be called with 'SEMANTIC_VIEW' as the semantic_model_or_view_type parameter, along with the view's fully qualified name.",,Migrating to native semantic views automatically grants SELECT privileges to the SNOWFLAKE.CORTEX_ANALYST_USER database role on all underlying tables referenced by the semantic model.,,"Native semantic views offer full support for VARIANT, OBJECT, GEOGRAPHY, and ARRAY data types within their dimension and fact columns, overcoming limitations of YAML-based models.",,"Semantic models defined as native semantic views are exclusively managed through Snowflake's Snowsight UI, removing the option for programmatic updates via SQL or the Snowflake CLI for enhanced control.",,,,"2,4",,
"A machine learning team has fine-tuned a llama3.1-70b model for a specialized task using Snowflake Cortex Fine-tuning, named prod_llama_responder. They now need to deploy this model for inference via the Cortex REST API across different Snowflake regions and manage its lifecycle effectively. Which of the following statements regarding the fine-tuned model's deployment, access, and management are accurate? (Select all that apply)",multi-select,"Fine-tuned models, such as prod_llama_responder, are managed through the Snowflake Model Registry's Python API, allowing programmatic updates to the model with new training data via a log_model() call.",,"To use a fine-tuned model via the Cortex REST API, the model argument in the API call should be its fully-qualified name, e.g., ""model"": ""<database>.<schema>.prod_llama_responder"".",,"If the fine-tuned model was trained in an AWS US West 2 (Oregon) account but needs to be accessed by an application in an Azure West Europe (Netherlands) account, Snowflake's cross-region inference feature handles this automatically without any additional configuration for the account.",,"The CORTEX_MODELS_ALLOWLIST account parameter can be used by administrators to restrict which specific LLMs, including fine-tuned models, are available for use with Cortex LLM functions and the REST API within a Snowflake account.",,"Fine-tuned models created with SNOWFLAKE.CORTEX.FINETUNE('CREATE', ...) are immutable; to update prod_llama_responder with improved performance, a new fine-tuning job must be created and trained.",,,,"2,4,5",,
An operations team at a company is implementing a robust governance framework to monitor and optimize the costs associated with their Snowflake Cortex LLM function usage. They need to identify which functions are driving the highest token consumption and overall credit usage to pinpoint areas for cost reduction. Which of the following monitoring tools or methods are appropriate for gaining these insights into Cortex LLM function costs and token consumption? (select all that apply),multi-select,"Querying the SNOWFLAKE.ACCOUNT_USAGE.CORTEX_FUNCTIONS_QUERY_USAGE_HISTORY view to obtain granular token usage details, including prompt_tokens and completion_tokens, for individual Cortex LLM function calls.",,Inspecting the SNOWFLAKE.ORGANIZATION_USAGE.METERING_DAILY_HISTORY view with a SERVICE_TYPE filter of 'AI_SERVICES' to get an aggregated daily credit consumption across all AI services within the organization.,,Analyzing the CORTEX_DOCUMENT_PROCESSING_USAGE_HISTORY view to track hourly pages processed and credits used by SNOWFLAKE.CORTEX.COMPLETE functions for multimodal image inputs.,,"Reviewing the guard_tokens field within the usage object returned by COMPLETE function calls when Cortex Guard is enabled, to understand the overhead of safety filtering.",,"Consulting the CORTEX_SEARCH_DAILY_USAGE_HISTORY view to monitor the EMBED_TEXT_TOKENS cost per input token, which applies to embedding LLM functions such as SNOWFLAKE.CORTEX.EMBED_TEXT_1024.",,,,"1,2,4",,
"A financial analytics team is using SNOWFLAKE.CORTEX.COMPLETE to extract specific financial metrics (e.g., revenue, profit margin) from quarterly reports and requires the output in a strict JSON format for automated ingestion into a data warehouse. They've encountered issues where the LLM sometimes generates malformed JSON or includes extraneous text. Which of the following approaches will help ensure deterministic, schema-compliant JSON outputs and mitigate these 'hallucinations' related to format? (Select four)",multi-select,"Utilise the response_format argument within COMPLETE to specify a detailed JSON schema, including type, properties, and required fields.",,"For OpenAI (GPT) models, ensure that the additionalProperties field is set to false in every node of the schema and that the required field lists all properties.",,"Include a prompt instruction such as 'Respond in JSON' to improve adherence, especially for complex tasks, even when response_format is provided.",,Set the 'temperature' option to 0 when calling COMPLETE to obtain the most consistent and deterministic JSON outputs.,,"Use the SNOWFLAKE.CORTEX.CLASSIFY_TEXT function to validate the JSON structure after generation, then re-prompt if validation fails.",,,,"1,2,3,4",,
"A security-conscious data scientist in an Azure East US 2 (Virginia) account wants to fine-tune a mistral-7b model for a specific text summarization task and then deploy it for real-time inference using the Cortex REST API. The mistral-7b base model is natively available for fine-tuning in Azure East US 2 (Virginia). For subsequent inference using the fine-tuned model, they need to understand the regional and cross-region inference considerations. Which of the following statements are correct? (Select four)",multi-select,The fine-tuning job for mistral-7b can proceed in Azure East US 2 (Virginia) as it is a supported region for the FINETUNE ('CREATE') function.,,"To use the fine-tuned mistral-7b model for inference via the Cortex REST API in a region where the base mistral-7b model is not natively supported, the CORTEX_ENABLED_CROSS_REGION account parameter must be configured.",,User inputs and outputs for inference requests to the fine-tuned model via cross-region inference will be stored or cached within the remote processing region to optimize performance.,,"The cost for inference on the fine-tuned mistral-7b model will be based on the number of tokens processed for both prompt and completion, with an additional charge for Cortex Guard tokens if enabled.",,"Snowflake Copilot, another Gen AI feature, also supports cross-region inference and its availability can be controlled by the CORTEX_ENABLED_CROSS_REGION parameter.",,,,"1,2,4,5",,
"An operations team is investigating an issue with a generative AI application powered by Snowflake Cortex Analyst, where users reported unexpected behavior in generated SQL. To diagnose the problem, they examine the detailed event logs captured by Snowflake AI Observability. Which categories of information can they expect to find in these event tables to assist their investigation? (Select four)",multi-select,The full text of the natural language questions submitted by the users.,,The exact SQL queries that Cortex Analyst generated in response to user questions.,,Any error messages or warnings that occurred during the processing of the request.,,The complete request and response bodies associated with the application's execution steps.,,Real-time CPU and memory usage statistics for the Snowflake virtual warehouse executing the LLM inference.,,,,"1,2,3,4",,
A data scientist is implementing a Retrieval Augmented Generation (RAG) system in Snowflake for a legal document repository. They need to convert legal document chunks into vector embeddings and efficiently find the most relevant document chunks based on a user's query. Which of the following statements accurately describe the process and best practices for creating and using these vector embeddings with Snowflake Cortex LLM functions? (select two),multi-select,"To create the embeddings for legal document chunks, the SNOWFLAKE.CORTEX.EMBED_TEXT_768 function should be used, specifying an appropriate model like 'snowflake-arctic-embed-m'.",,"When comparing a user's query embedding with document embeddings, the VECTOR_L1_DISTANCE function is generally recommended over VECTOR_COSINE_SIMILARITY for RAG applications to ensure optimal semantic relevance.",,"For best search results in RAG, legal document text should be split into chunks of no more than 512 tokens, as smaller chunks typically lead to higher retrieval quality.",,"Embedding functions like EMBED_TEXT_768 and EMBED_TEXT_1024 incur compute costs based on both input and output tokens, similar to how AI_COMPLETE is billed.",,"The VECTOR data type in Snowflake only supports integer elements, meaning legal document embeddings must be converted to integer vectors before storage.",,,,"1,4",,
"A multinational corporation is implementing Document AI to automate the processing of purchase orders from various global suppliers. These purchase orders vary significantly in layout and are often submitted in English, German, and Spanish. The data engineering team aims to optimize the preparation phase for effective model training and deployment. Considering Document AI's 'Question optimization best practices' and general document preparation guidelines, which of the following is a 'critical consideration' for successful implementation?",multiple-choice,"For multilingual support, it is mandatory to externally translate all non-English purchase orders to English before uploading them to an internal stage, as Document AI only processes English text.",,"The training dataset should be highly diverse, representing various layouts, data variations (including potential NULLs), and containing documents in all target languages (English, German, Spanish) to ensure robust model performance.",,"To simplify prompt engineering, define generic questions such as 'What is the total amount?' irrespective of document layout, as Document AI's foundation model is expected to handle most layout variations through its zero-shot capabilities.",,"For maximum efficiency in defining data values for complex extractions (e.g., lists of line items), prioritize spending extensive time on crafting highly precise and detailed natural language prompts to guide the model.",,"Document AI model builds can only support a single document layout type; therefore, separate model builds must be created for each distinct purchase order layout from different suppliers.",,,,2,,
An AI development team is deploying a new Cortex Agent and needs to ensure optimal performance and adherence to Snowflake's Gen AI principles regarding data governance. Which of the following statements accurately reflect the models supported by Cortex Agents and the data governance considerations? (select three),multi-select,"Cortex Agents exclusively use proprietary Snowflake models, such as Snowflake Arctic, ensuring all data remains within Snowflake's governance boundary without exception.",,"Supported LLMs for orchestration by Cortex Agents include llama3.1-70b, mistral-large2, and claude-3-5-sonnet. Cross-region inference may be required if the model is not available in the local region.",,"Customer Data, including inputs and outputs from Cortex Agents, is not used to train or fine-tune models made available to others, and fine-tuned models built with customer data are exclusively for that customer's use.",,"Cortex Agents support all models available through the AI_COMPLETE function, including those that require explicit opt-in for Azure OpenAI GPT models, with data always staying within Snowflake's governance boundary.",,"To use Cortex Agents, a role must be granted the SNOWFLAKE.CORTEX_AGENT_USER database role, which provides access specifically to the Agents feature.",,,,"2,3,5",,
"A financial services company is developing an automated data pipeline in Snowflake to process Federal Reserve Meeting Minutes, which are initially loaded as PDF documents. The pipeline needs to extract specific entities like the FED's stance on interest rates ('hawkish', 'dovish', or 'neutral') and the reasoning behind it, storing these as structured JSON objects within a Snowflake table. The goal is to ensure the output is always a valid JSON object with predefined keys. Which AI_COMPLETE configuration, used within an in-line SQL statement in a task, is most effective for achieving this structured extraction directly in the pipeline?",multiple-choice,"Using a simple prompt like ""Extract FED stance on interest rates and the reasoning as JSON from the document: [document_text]"" and expecting the LLM to format it correctly without further configuration.",,"Setting the temperature parameter to 0 and max_tokens to a sufficiently large value, along with a prompt to output JSON, to inherently guide the LLM to a structured format.",,"Employing the response_format argument within AI_COMPLETE with a JSON schema that explicitly defines the stance (enum: [""hawkish"", ""dovish"", ""neutral""]) and reasoning (string) fields, ensuring strict adherence to the output structure.",,"Utilizing multiple calls to SNOWFLAKE.CORTEX.EXTRACT_ANSWER() or AI_EXTRACT(), one for the stance and another for the reasoning, then manually constructing the JSON in a subsequent SQL step.",,"Relying on default AI_COMPLETE behavior, as Snowflake Cortex automatically detects the need for JSON output when entity extraction with specific fields is implied by the prompt.",,,,3,,
"A business analyst is using a Cortex Analyst-powered conversational application to query structured data in Snowflake. They initially ask, 'What was the total profit from California last quarter?' and then follow up with, 'What about New York?' The application successfully provides accurate answers to both questions. Which of the following statements explain how Cortex Analyst supports this multi-turn conversational experience and maintains accuracy? (Select three)",multi-select,"Cortex Analyst stores the full, verbatim history of all previous user prompts and LLM responses, which are then passed to every subsequent LLM call to ensure complete context retention without any summarization.",,"To handle follow-up questions, Cortex Analyst leverages an internal LLM summarization agent (e.g., Llama 3.1 70B) to reframe the current-turn question by retrieving context from the conversation history, rather than simply passing the entire history.",,"The accuracy of the SQL generated by Cortex Analyst for follow-up questions is significantly enhanced by its integration with a Verified Query Repository (VQR), which stores pre-verified natural language questions and their corresponding SQL queries.",,"For multi-turn conversations, Cortex Analyst primarily relies on semantic search over sample values defined in the semantic model to infer context and generate SQL, making explicit conversation history management unnecessary.",,"The semantic model YAML file, which defines logical tables, dimensions, and measures, is crucial for Cortex Analyst to bridge the gap between business terminology and underlying technical schema, thereby improving text-to-SQL conversion accuracy for both initial and follow-up queries.",,,,"2,3,5",,
