Question,Question Type,Answer Option 1,Explanation 1,Answer Option 2,Explanation 2,Answer Option 3,Explanation 3,Answer Option 4,Explanation 4,Answer Option 5,Explanation 5,Answer Option 6,Explanation 6,Correct Answers,Overall Explanation,Domain
"A financial institution uses Snowflake Cortex LLM functions to process customer feedback. They initially used SNOWFLAKE.CORTEX.SENTIMENT for general sentiment analysis. Now, they need to extract specific sentiment categories (e.g., 'service_quality', 'product_pricing') and the sentiment for each, expecting the output in a structured JSON format for automated downstream processing. Which AI_COMPLETE configuration best addresses their new requirement while considering cost-efficiency and output reliability?",multiple-choice,"SELECT AI_COMPLETE( model => 'mistral-7b', prompt => 'Analyze sentiment categories: service_quality, product_pricing from: ', response_format => {'type': 'json', 'schema': {'type': 'object', 'properties': {'service_quality': {'type': 'string'}, 'product_pricing': {'type': 'string'}}}} );",,"SELECT AI_COMPLETE( model => 'claude-3-5-sonnet', prompt => 'Respond in JSON. Extract service_quality and product_pricing sentiment from: ', response_format => {'type': 'json', 'schema': {'type': 'object', 'properties': {'service_quality': {'type': 'string', 'description': 'Sentiment for service quality'}, 'product_pricing': {'type': 'string', 'description': 'Sentiment for product pricing'}}, 'required': ['service_quality', 'product_pricing']}} );",,"SELECT AI_COMPLETE( model => 'llama3-8b', prompt => 'Give me sentiment for service_quality and product_pricing in JSON from: ', options => {'temperature': 1.0} );",,"SELECT AI_COMPLETE( model => 'mistral-large2', prompt => 'Extract sentiment for service_quality and product_pricing from: ', options => {'guardrails': TRUE} );",,"SELECT SNOWFLAKE.CORTEX.CLASSIFY_TEXT( input => '', list_of_categories => ['service_quality_positive', 'service_quality_negative', 'product_pricing_positive', 'product_pricing_negative'] );",,,,1,,
"A Gen AI Specialist is setting up their Snowflake environment to deploy a high-performance open-source LLM for real-time inference using Snowpark Container Services (SPCS). They need to create a compute pool that can leverage NVIDIA GPUs to optimize model performance. Which of the following SQL statements correctly creates a compute pool capable of supporting an intensive GPU usage scenario, such as serving LLMs, while adhering to common configuration best practices for a new, small-scale deployment in Snowpark Container Services? (select all that apply)",multi-select,CREATE COMPUTE POOL llm_gpu_pool MIN_NODES=1 MAX_NODES=2 INSTANCE_FAMILY=CPU_X64_M AUTO_SUSPEND_SECS=3600;,,CREATE COMPUTE POOL llm_gpu_pool MIN_NODES=1 MAX_NODES=10 INSTANCE_FAMILY=GPU_NV_S AUTO_RESUME=TRUE;,,CREATE COMPUTE POOL llm_gpu_pool MIN_NODES=2 MAX_NODES=4 INSTANCE_FAMILY=HIGHMEM_X64_L AUTO_SUSPEND_SECS=0;,,CREATE COMPUTE POOL llm_gpu_pool MIN_NODES=1 MAX_NODES=12 INSTANCE_FAMILY=GPU_NV_M AUTO_SUSPEND_SECS=1800;,,CREATE COMPUTE POOL llm_gpu_pool MIN_NODES=1 MAX_NODES=10 INSTANCE_FAMILY=CPU_X64_XS AUTO_RESUME=FALSE;,,,,"2,4",,
A data engineering team is setting up a Retrieval Augmented Generation (RAG) application using Snowflake Cortex Search to provide contextual answers from customer support transcripts. The transcripts are stored in a Snowflake table named SUPPORT_TRANSCRIPTS. Which of the following statements are crucial considerations or accurate facts regarding the initial setup and configuration of the Cortex Search Service for this use case? (Select all that apply),multi-select,"The CREATE CORTEX SEARCH SERVICE command requires that CHANGE_TRACKING = TRUE be enabled on the source table, especially if the role creating the service is not the table owner. This ensures that the service can track updates to the base data.",,"Snowflake recommends using a dedicated virtual warehouse of any size, including X-Large or 2X-Large, for each Cortex Search Service to ensure the fastest possible materialization of search indexes during creation and refresh.",,Columns specified in the ATTRIBUTES field during service creation are only used for filtering search results and do not need to be present in the source query.,,"Cortex Search is designed to get users up and running quickly with a hybrid (vector and keyword) search engine on text data, handling embedding, infrastructure maintenance, and search quality parameter tuning automatically.",,The Cortex Search Service can effectively be used as a RAG engine for LLM chatbots by leveraging semantic search capabilities to provide customized and contextualized responses from the text data.,,,,"1,4,5",,
"A development team is building a RAG application in Snowflake Cortex that needs to extract high-fidelity text and layout from a collection of technical documentation PDFs stored in an internal stage to power semantic search and LLM responses. They want to ensure proper context retrieval for complex user queries. Given this scenario, which of the following actions or statements are crucial for effectively leveraging AI_PARSE_DOCUMENT to optimize the RAG pipeline? (select all that apply)",multi-select,"The team should utilize AI_PARSE_DOCUMENT in OCR mode to ensure layout preservation and proper reading order, which is critical for high-fidelity context retrieval in RAG.",,"Documents must be uploaded to a directory table enabled stage, and the TO_FILE function with the @stage_name reference should be used to provide file access to AI_PARSE_DOCUMENT for processing.",,"For optimal RAG performance, the extracted text from documents should be chunked into smaller segments, ideally no more than 512 tokens, before being embedded into vector space for semantic search.",,"AI_PARSE_DOCUMENT is specifically designed for entity extraction and summarization, and is not recommended for high-fidelity text and layout extraction required for RAG applications.",,"If the documents contain images with text, using a separate OCR service prior to AI_PARSE_DOCUMENT is necessary because AI_PARSE_DOCUMENT can only process digital-born text.",,,,"2,3",,
"A development team is creating a new search application using Snowflake Cortex Search. They are currently using a 'snowflake-arctic-embed-l-v2.0' embedding model. After an initial load of 10 million rows, each with approximately 500 tokens of text, they want to minimize 'EMBED_TEXT_TOKENS' costs for future updates and ongoing operations. Considering their goal to optimize 'EMBED_TEXT_TOKENS' costs, which two strategies should the team prioritize for their Cortex Search Service? (Select all that apply)",multi-select,"Select an embedding model with a lower credit cost per million tokens, such as snowflake-arctic-embed-m-v1.5, if its performance is sufficient for their use case.",,"Implement a text chunking strategy using functions like SPLIT_TOKENS_RECURSIVE_CHARACTER to break down each 500-token row into smaller chunks, effectively reducing the total number of tokens processed for embeddings.",,"Increase the TARGET_LAG for the Cortex Search Service to reduce the frequency of automatic refreshes, thus decreasing the number of times embedding jobs are executed.",,Upgrade the virtual warehouse size assigned to the Cortex Search Service to an 'L' or 'XL' to accelerate the embedding process and reduce the overall EMBED_TEXT_TOKENS billing duration.,,"Reduce the number of attributes specified in the 'CREATE_CORTEX_SEARCH_SERVICE' statement, as each attribute incurs a separate embedding cost.",,,,"1,3",,
"A data scientist fine-tuned a mistral-7b model in Snowflake for a specific customer support response generation task, naming it my_custom_responder_model. They now want to make this model available for AI_COMPLETE calls in production, ensuring proper access control and regional availability. Which of the following statements is true regarding the deployment and management of this fine-tuned model in Snowflake?",multiple-choice,"To make my_custom_responder_model available for inference, the data scientist must register it in the Snowflake Model Registry using the snowflake.ml.registry.Registry().log_model() Python API, as it is a custom model.",,"If my_custom_responder_model was fine-tuned in AWS US West 2 (Oregon) but needs to be used for inference in an Azure East US 2 (Virginia) account, cross-region inference will be automatically handled by Snowflake Cortex without any explicit parameter configuration.",,"Administrators can restrict access to my_custom_responder_model and other specific LLMs within the account by setting the CORTEX_MODELS_ALLOWLIST account parameter, which controls model availability for Cortex LLM functions.",,Any user role calling AI_COMPLETE with my_custom_responder_model must have the SNOWFLAKE_DOCUMENT_INTELLIGENCE_CREATOR database role granted to access fine-tuned models.,,"To update my_custom_responder_model with new training data and improve its performance, the existing model can be directly updated using an ALTER_SNOWFLAKE_CORTEX_FINETUNE 'UPDATE' SQL command, specifying the new training data.",,,,3,,
A data analyst needs to use SNOWFLAKE.CORTEX.EXTRACT_ANSWER to streamline information retrieval from various contract documents. They are new to Cortex functions and want to understand access requirements and optimal usage. Which of the following statements about using SNOWFLAKE.CORTEX.EXTRACT_ANSWER are correct? (Select all that apply),multi-select,The analyst's role must be granted the SNOWFLAKE.CORTEX_USER database role to execute EXTRACT_ANSWER functions.,,"For optimal accuracy, the source_document input should be in plain English, and the question should be specific, asking for a single value.",,"If EXTRACT_ANSWER encounters an unresolvable issue during processing, it returns NULL instead of an error, similar to TRY_COMPLETE.",,"EXTRACT_ANSWER is the most current and recommended function for all text extraction tasks, offering multi-label and image extraction capabilities.",,"It is generally recommended to process multiple documents by applying EXTRACT_ANSWER to a table column containing the document texts, allowing for efficient batch processing.",,,,"1,2,5",,
"An administrator has configured the CORTEX_MODELS_ALLOWLIST parameter to only permit the mistral-large model at the account level. A user with a role, which has been granted SNOWFLAKE.CORTEX_USER and SNOWFLAKE.CORTEX_MODEL_ROLE_LLAMA3.1-70B, attempts to execute several queries. Which of the following queries will successfully execute?",multiple-choice,"SELECT AI_COMPLETE('MISTRAL-LARGE', 'Generate a short poem about snow.');",,"SELECT AI_COMPLETE('SNOWFLAKE-MODELS', 'Explain the concept of RAG.');",,"SELECT AI_COMPLETE('llama3.1-70b', 'Describe the benefits of using Snowflake Cortex.');",,"SELECT AI_COMPLETE('snowflake-arctic', 'What are the key features of the AI Data Cloud?');",,ALTER ACCOUNT SET CORTEX_MODELS_ALLOWLIST = 'SNOWFLAKE-ARCTIC';,,,,1,,
"A team of data application developers is leveraging Snowflake Copilot to streamline the creation of analytical SQL queries within their Streamlit in Snowflake application. They observe that Copilot sometimes struggles with complex joins or provides suboptimal queries when dealing with a newly integrated, deeply nested dataset. Based on Snowflake's best practices and known limitations, which actions or considerations would help improve Copilot's performance in this scenario? (Select all that apply)",multi-select,"Implement curated views with descriptive and easy-to-understand names for views and columns, appropriate data types, and pre-define common/complex joins to simplify the underlying schema for Copilot.",,"Enable the CORTEX_MODELS_ALLOWLIST parameter to restrict Copilot to only use the largest available LLMs, thereby guaranteeing higher accuracy for complex queries.",,"Break down complex requests into simpler, multi-turn questions, as Copilot is designed to build complex queries through conversational refinement and follow-up questions.",,"Grant Copilot direct access to the raw data using ACCOUNTADMIN privileges, allowing it to infer schema relationships more effectively from data content.",,"Ensure that a database and schema are explicitly selected for the current session, and that column names are meaningful, to provide Copilot with better context for query generation.",,,,"1,3,5",,
"An ML engineer is deploying a custom PyTorch-based image classification model, obtained from Hugging Face, to Snowpark Container Services (SPCS). The deployment requires GPU acceleration on a compute pool named 'my_gpu_pool' and specific Python packages ('torch', 'transformers', 'opencv-python'). The scenario dictates that 'opencv-python' is only available via PyPI, while 'torch' and 'transformers' can be sourced from either conda-forge or PyPI. The engineer uses the Snowflake Model Registry to log the model. Which of the following log_model and create_service configurations correctly specify the necessary Python dependencies and GPU utilization for this inference service, adhering to Snowflake's recommendations? (Select all that apply)",multi-select,"pip_model = reg.log_model( my_hf_model, model_name=""image_classifier"", version_name=""v1"", pip_requirements=[""torch"", ""transformers"", ""opencv-python""], sample_input_data=sample_data ); pip_model.create_service( service_name=""image_inference_service"", service_compute_pool=""my_gpu_pool"", gpu_requests=""1"", ingress_enabled=True );",,"conda_model = reg.log_model( my_hf_model, model_name=""image_classifier"", version_name=""v2"", conda_dependencies=[""conda-forge::pytorch"", ""conda-forge::transformers"", ""conda-forge::opencv-python""], sample_input_data=sample_data ); conda_model.create_service( service_name=""image_inference_service"", service_compute_pool=""my_gpu_pool"", gpu_requests=""1"", ingress_enabled=True );",,"pip_model = reg.log_model( my_hf_model, model_name=""image_classifier"", version_name=""v3"", pip_requirements=[""torch"", ""transformers"", ""opencv-python""], sample_input_data=sample_data ); pip_model.create_service( service_name=""image_inference_service"", service_compute_pool=""my_cpu_pool"", gpu_requests=""1"", ingress_enabled=True );",,"conda_model = reg.log_model( my_hf_model, model_name=""image_classifier"", version_name=""v4"", conda_dependencies=[""pytorch"", ""transformers"", ""opencv-python""], sample_input_data=sample_data ); conda_model.create_service( service_name=""image_inference_service"", service_compute_pool=""my_gpu_pool"", gpu_requests=""1"", ingress_enabled=True );",,"mixed_deps_model = reg.log_model( my_hf_model, model_name=""image_classifier"", version_name=""v5"", conda_dependencies=[""conda-forge::torch"", ""conda-forge::transformers""], pip_requirements=[""opencv-python""], sample_input_data=sample_data ); mixed_deps_model.create_service( service_name=""image_inference_service"", service_compute_pool=""my_gpu_pool"", gpu_requests=""1"", ingress_enabled=True );",,,,"1,5",,
A data scientist is tasked with improving the accuracy of an LLM-powered chatbot that answers user questions based on internal company documents stored in Snowflake. They decide to implement a Retrieval Augmented Generation (RAG) architecture using Snowflake Cortex Search. Which of the following statements correctly describe the features and considerations when leveraging Snowflake Cortex Search for this RAG application? (Select all that apply),multi-select,"Cortex Search automatically handles text chunking and embedding generation for the source data, eliminating the need for manual ETL processes for these steps.",,"To create a Cortex Search Service, one must explicitly specify an embedding model and manually manage its underlying infrastructure, similar to deploying a custom model via Snowpark Container Services.",,"For optimal results with Cortex Search, source text should be pre-split into chunks of no more than 512 tokens, even when using models with larger context windows like snowflake-arctic-embed-l-v2.0-8k.",,"The snowflake-arctic-embed-l-v2.0-8k model is a fully managed embedding model provided by Snowflake, specifically optimized for use with Cortex Search.",,Enabling change tracking on the source table for the Cortex Search Service is optional; the service will still refresh automatically even if change tracking is disabled.,,,,"1,4",,
"A data application developer is building a Streamlit application within Snowflake. This application uses a RAG pattern to answer user questions about a knowledge base, leveraging a Cortex Search Service for retrieval and an LLM for generating responses. The developer wants to ensure responses are relevant, concise, and structured. Which of the following practices are crucial when integrating Cortex Search with Snowflake Cortex LLM functions like AI_COMPLETE for this RAG chatbot?",multi-select,The snowflake-arctic-embed-l-v2.0-8k embedding model must be manually specified in the Cortex Search Service configuration to ensure compatibility with the AI_COMPLETE function.,,"To maintain conversational context in a multi-turn chat, the developer should pass all previous user prompts and model responses in the AI_COMPLETE function's chat_history parameter.",,"The retrieved context from Cortex Search should be directly concatenated with the user's prompt as input to the AI_COMPLETE function, using a system prompt to instruct the LLM on how to use the provided context.",,Using the SNOWFLAKE.CORTEX.EMBED_TEXT_768 function is redundant and inefficient when a Cortex Search Service is already being used for retrieval.,,"For performance and cost optimization, it is always recommended to query Cortex Search and the LLM function within a single stored procedure to minimize network latency.",,,,"2,3,4",,
"A security administrator at a large financial institution needs to enforce a strict policy on which Large Language Models (LLMs) from Snowflake Cortex can be used within their account. They specifically want to restrict access to only llama3.1-8b and mistral-7b for all users calling Cortex functions like AI_COMPLETE and TRY_COMPLETE, as well as those interacting through the Cortex LLM Playground. Additionally, a data science team has developed and registered a custom schema-level model object named custom_sentiment_model (which wraps an approved LLM) and granted USAGE on it to a specific ds_team_role. Which of the following statements accurately describe the outcome of this configuration?",multi-select,"The 'ACCOUNTADMIN' must execute the SQL command: ALTER ACCOUNT SET CORTEX_MODELS_ALLOWLIST = ('llama3.1-8b', 'mistral-7b');",,"Users with ds_team_role will still be able to successfully call SELECT SNOWFLAKE.CORTEX.COMPLETE('custom_sentiment_model', 'review text');",,"If a user attempts to call an LLM not explicitly listed in the CORTEX_MODELS_ALLOWLIST via the Cortex LLM Playground, Snowflake will automatically fall back to the snowflake-arctic model for that request.",,"The CORTEX_MODELS_ALLOWLIST parameter provides granular control at the database or schema level, allowing administrators to define different sets of approved models for different data contexts.",,Enabling Cortex Guard for AI_COMPLETE through the guardrails option automatically bypasses the CORTEX_MODELS_ALLOWLIST to ensure all LLMs can be used for content safety filtering.,,,,"1,2",,
"An ML engineer is preparing a Docker image for a custom LLM application that will be deployed to Snowpark Container Services (SPCS). The application uses a mix of packages, some commonly found in the Snowflake Anaconda channel and others from general open-source repositories like PyPI. They have the following Dockerfile snippets and need to ensure the dependencies are correctly installed for the SPCS environment to support a GPU workload. Which of the following approaches for installing Python packages in the Dockerfile would ensure a robust and compatible setup for a custom LLM running in Snowpark Container Services, based on best practices for managing dependencies in this environment?",multiple-choice,RUN pip install snowflake-ml-python snowflake-snowpark-python pandas jupyterlab transformers==4.34.0 tokenizers peft sentencepiece vllm bitsandbytes datasets absl-py==1.3.0,,RUN conda install -n rapids -c https://repo.anaconda.com/pkgs/snowflake snowflake-ml-python snowflake-snowpark-python pandas jupyterlab transformers==4.34.0 tokenizers peft sentencepiece vllm bitsandbytes datasets absl-py==1.3.0 && pip install transformers==4.34.0 tokenizers peft sentencepiece vllm bitsandbytes datasets absl-py==1.3.0,,RUN conda install -n rapids -c conda-forge snowflake-ml-python snowflake-snowpark-python pandas jupyterlab transformers==4.34.0 tokenizers peft sentencepiece vllm bitsandbytes datasets absl-py==1.3.0 && pip install peft sentencepiece vllm bitsandbytes datasets absl-py==1.3.0,,RUN conda install -n rapids -c defaults snowflake-ml-python snowflake-snowpark-python pandas jupyterlab transformers==4.34.0 tokenizers peft sentencepiece vllm bitsandbytes datasets absl-py==1.3.0 && pip install transformers==4.34.0 tokenizers peft sentencepiece vllm bitsandbytes datasets absl-py==1.3.0,,RUN apt-get update && apt-get -y --no-install-recommends install python3-pip && pip install --no-cache-dir -r requirements.txt,,,,2,,
"A Gen AI Specialist is tasked with preparing a Cortex Analyst semantic model to provide a predefined set of initial questions for new business users to explore their data. They want these specific questions to always be displayed, irrespective of what the user might initially type, as part of an onboarding experience. Which of the following actions, or combinations of actions, must the Specialist take to successfully configure a semantic model to display a full set of predefined ""onboarding questions"" in Cortex Analyst?",multi-select,Define a Verified Query Repository (VQR) within the semantic model YAML file and include the specific questions as verified queries.,,"For each desired onboarding question in the VQR, set the use_as_onboarding_question flag to true.",,Ensure that the ENABLE_ONBOARDING_QUESTIONS parameter is set to TRUE in the semantic model's configuration.,,Limit the total number of onboarding questions to a maximum of five to ensure they are all displayed.,,Provide a detailed description for each measure and dimension in the model's YAML file to improve the quality of results.,,,,"1,2",,
A data scientist is designing a Retrieval Augmented Generation (RAG) system in Snowflake for querying a large knowledge base of internal documents. They plan to store document embeddings and use vector similarity for retrieval. Which statement accurately describes the use of vector similarity functions and associated costs in this RAG architecture?,multiple-choice,"The VECTOR_INNER_PRODUCT function is less efficient than other vector similarity functions in Snowflake, leading to higher compute costs.",,"Storing vector embeddings, created using functions like EMBED_TEXT_768, incurs additional storage costs but does not impact query compute costs.",,"When using VECTOR_INNER_PRODUCT for similarity search, standard Snowflake compute costs apply, and there is no additional premium fee for using vector functions.",,"VECTOR_COSINE_SIMILARITY and VECTOR_L2_DISTANCE are not supported in Snowpark Python, limiting development options for RAG systems.",,"Snowpark Python fully supports all Snowflake vector similarity functions, including VECTOR_INNER_PRODUCT, VECTOR_L1_DISTANCE, and VECTOR_COSINE_SIMILARITY.",,,,3,,
"An ML engineer has developed a custom PyCaret classification model and wants to deploy it to Snowpark Container Services (SPCS) for inference using the Snowflake Model Registry. The model requires specific versions of pycaret, scipy, and joblib. The engineer also wants to make the service accessible via an HTTP endpoint. Which of the following Model Registry and service creation steps are most appropriate for the ML engineer? (Select all that apply)",multi-select,"Ensure the ModelContext specifies the model_file attribute pointing to the serialized PyCaret model, for example: custom_model_context = ModelContext(model_file=""pycaret_best_model.pkl"").",,"Log the model using reg.log_model, specifying conda_dependencies which would be resolved from the Snowflake Anaconda channel for warehouse deployment, and setting target_platforms to [""SNOWPARK_CONTAINER_SERVICES""].",,"Log the model using reg.log_model, specifying pip_requirements with exact versions like ""pycaret==3.1.1"", ""scipy==1.11.4"", and ""joblib==1.2.0"", as pip_requirements are often necessary for custom third-party Python packages in SPCS.",,"Create the service using model.create_service, ensuring ingress_enabled = True and specifying gpu_requests = 1 if the compute pool is GPU-enabled.",,"Opt for warehouse deployment instead of SPCS, as PyCaret is not natively supported by Snowflake and managing its dependencies in SPCS would be overly complex compared to a warehouse.",,,,"1,3,4",,
